{
    "$schema": "https://json-schema.org/draft-06/schema",
    "title": "Substitution",
    "description": "Describes a job ad for a substitution",
    "type": "object",
    "properties": {
        "id": {
            "description": "Unique identifier for substitution",
            "type": "integer"
        },
        "date": {
            "description": "The date the job ad was left in a format that adheres to ISO 8601, for example output of Javascripts Date.toJSON()",
            "type": "string"
        },
        "title": {
            "description": "Job title",
            "type": "string"
        },
        "description": {
            "description": "Short description for the job",
            "type": "string"
        },
        "department": {
            "description": "Name of the department the job is located in",
            "type": "string"
        },
        "organisation": {
            "description": "Name of the organisation",
            "type": "string"
        },
        "location": {
            "description": "Location of the job, should resemble this format: Käsityöläiskatu 2, 20100 TURKU",
            "type": "string"
        },
        "city": {
            "description": "City or municipality where the job is located",
            "type": "string"
        },
        "coordinates": {
            "description": "Coordinates for the job, longitude and latitude in decimal degrees",
            "type": "object",
            "properties": {
                "longitude": {
                    "type":"number"
                },
                "latitude": {
                    "type":"number"
                }
            }
        },
        "timing": {
            "description": "Shift start time and duration",
            "type": "object",
            "properties": {
                "startTime": {
                    "description": "The starting time of a shift in a format that adheres to ISO 8601",
                    "type": "string"
                },
                "duration": {
                    "description": "Duration of the shift in minutes",
                    "type": "integer",
                    "exclusiveMinimum": 0
                },
                "isFlexible": {
                    "description": "Describes if the shift timing is flexible",
                    "type": "boolean"
                }
            },
            "required": [ "startTime", "duration" ]
        },
        "hourlyPay": {
            "description": "Hourly pay in euros",
            "type": "number",
            "exclusiveMinimum": 0
        },
        "benefits": {
            "description": "List of benefits like lunch or bonuses",
            "type": "array",
            "items": {
                "type": "string"
            }
        },
        "contactInfo": {
            "description": "Contact info of the employer",
            "type": "object",
            "properties": {
                "email": {
                    "type": "string"
                },
                "phoneNumber": {
                    "type": "string"
                }
            }
        },
        "logo": {
            "description": "Filename of logo image",
            "type": "string"
        },
        "image": {
            "description": "URL that retrieves an image",
            "type": "string"
        }
    },
    "required": [ "id", "title", "description", "organisation", "location", "timing", "hourlyPay" ]
}
